{
  "schema": "bv.regional",
  "version": 2,
  "document_id": "db46ad55-18ee-49cc-8601-73774a9dc861",
  "title": "Prompt Enhancer Test - Anima Sentence Cafe Scene",
  "canvas": {
    "width": 1536,
    "height": 1024
  },
  "prompts": {
    "global": {
      "positive_source": "Two people are sitting together in a cozy cafe. The scene should feel calm and detailed, with pleasant natural lighting.",
      "negative_source": "The image should not look blurry, distorted, unfinished, or low quality."
    },
    "background": {
      "positive_source": "The cafe has wooden tables and large windows. Warm light fills the room and creates a comfortable atmosphere.",
      "negative_source": "The background should not be empty, blurry, flat, or distracting."
    }
  },
  "negative_mode": "prompt",
  "overlap": {
    "mode": "joint"
  },
  "regions": [
    {
      "id": "131eb933-a69b-45c4-86b7-851486174094",
      "name": "Woman",
      "parent_region_id": null,
      "enabled": true,
      "strength": 1.0,
      "priority": 10,
      "usage": "generation",
      "prompts": {
        "positive_source": "A woman with short black hair wears a red jacket. She sits calmly and holds a white coffee cup in her hands.",
        "negative_source": "She should not have blonde hair, a blue jacket, malformed hands, or the wrong cup."
      },
      "mask": {
        "feather": 0.015
      },
      "geometry": [
        {
          "id": "8ec2ff15-44db-4be2-aa51-919e25e4884e",
          "type": "ellipse",
          "operation": "add",
          "x": 0.08,
          "y": 0.08,
          "width": 0.42,
          "height": 0.84
        }
      ],
      "authoring": {
        "visible": true,
        "locked": false,
        "color": "#E45756"
      }
    },
    {
      "id": "ad306050-6c76-408a-b4f0-11f8ccfa7954",
      "name": "Man",
      "parent_region_id": null,
      "enabled": true,
      "strength": 1.0,
      "priority": 20,
      "usage": "generation",
      "prompts": {
        "positive_source": "A man with curly brown hair wears a green sweater. He sits opposite the woman and has an open notebook on the table near him.",
        "negative_source": "He should not have straight black hair, a red sweater, malformed hands, or a missing notebook."
      },
      "mask": {
        "feather": 0.015
      },
      "geometry": [
        {
          "id": "f567def7-955b-4c3d-bea0-c3abe8027703",
          "type": "ellipse",
          "operation": "add",
          "x": 0.5,
          "y": 0.08,
          "width": 0.42,
          "height": 0.84
        }
      ],
      "authoring": {
        "visible": true,
        "locked": false,
        "color": "#54A24B"
      }
    },
    {
      "id": "69cac647-617c-4fb6-977d-0975a9e06a24",
      "name": "Table",
      "parent_region_id": null,
      "enabled": true,
      "strength": 0.8,
      "priority": 100,
      "usage": "generation",
      "prompts": {
        "positive_source": "A wooden table stands between them. The white coffee cup belongs near the woman, while the open notebook belongs near the man. Their hands remain visible.",
        "negative_source": "The cup should not appear near the man, and the notebook should not appear near the woman. Do not duplicate or mix up the objects."
      },
      "mask": {
        "feather": 0.01
      },
      "geometry": [
        {
          "id": "a86df310-b62c-44b2-901a-88ca8357d108",
          "type": "rect",
          "operation": "add",
          "x": 0.22,
          "y": 0.55,
          "width": 0.56,
          "height": 0.32
        }
      ],
      "authoring": {
        "visible": true,
        "locked": false,
        "color": "#4C78A8"
      }
    }
  ]
}
