{
  "schema": "bv.regional",
  "version": 2,
  "document_id": "7ab5fd0e-06f2-4e36-b37f-61ff59a499d1",
  "title": "Prompt Enhancer Test - Weak Cafe Scene",
  "canvas": {
    "width": 1536,
    "height": 1024
  },
  "prompts": {
    "global": {
      "positive_source": "a picture, two people, cafe, good quality, detailed, nice lighting",
      "negative_source": "bad, ugly, low quality, things wrong"
    },
    "background": {
      "positive_source": "cafe background with tables and windows, warm, detailed background, nice atmosphere",
      "negative_source": "bad background, empty, blurry stuff"
    }
  },
  "negative_mode": "prompt",
  "overlap": {
    "mode": "joint"
  },
  "regions": [
    {
      "id": "d34403c6-0437-4e51-a90b-f5e730693091",
      "name": "Woman on the left",
      "parent_region_id": null,
      "enabled": true,
      "strength": 1.0,
      "priority": 10,
      "usage": "generation",
      "prompts": {
        "positive_source": "woman left, red jacket, black short hair, sitting, holding white coffee cup, detailed woman, looks calm",
        "negative_source": "blue jacket, blonde hair, wrong cup, bad hands"
      },
      "mask": {
        "feather": 0.015
      },
      "geometry": [
        {
          "id": "33a2bbb6-380d-448e-810b-77c6c3cd3623",
          "type": "ellipse",
          "operation": "add",
          "x": 0.08,
          "y": 0.08,
          "width": 0.42,
          "height": 0.84
        }
      ],
      "authoring": {
        "visible": true,
        "locked": false,
        "color": "#E45756"
      }
    },
    {
      "id": "23fcc2a5-966f-4664-bc7f-55aa50e406be",
      "name": "Man on the right",
      "parent_region_id": null,
      "enabled": true,
      "strength": 1.0,
      "priority": 20,
      "usage": "generation",
      "prompts": {
        "positive_source": "man on right side, green sweater, brown curly hair, sitting opposite, notebook on table, detailed, realistic",
        "negative_source": "red sweater, straight black hair, no notebook, deformed"
      },
      "mask": {
        "feather": 0.015
      },
      "geometry": [
        {
          "id": "0c8f7f03-97cd-4784-989e-f85e63a6a842",
          "type": "ellipse",
          "operation": "add",
          "x": 0.5,
          "y": 0.08,
          "width": 0.42,
          "height": 0.84
        }
      ],
      "authoring": {
        "visible": true,
        "locked": false,
        "color": "#54A24B"
      }
    },
    {
      "id": "ec70fe95-0a42-4276-bc30-98167ae471dc",
      "name": "Shared table interaction",
      "parent_region_id": null,
      "enabled": true,
      "strength": 0.8,
      "priority": 100,
      "usage": "generation",
      "prompts": {
        "positive_source": "wood table, white coffee cup near woman, open notebook near man, their hands visible, objects correct places",
        "negative_source": "cup near man, notebook near woman, duplicated cup, duplicated notebook, mixed objects"
      },
      "mask": {
        "feather": 0.01
      },
      "geometry": [
        {
          "id": "41eb262f-ef9e-4cef-ad8b-3a9216192c57",
          "type": "rect",
          "operation": "add",
          "x": 0.22,
          "y": 0.55,
          "width": 0.56,
          "height": 0.32
        }
      ],
      "authoring": {
        "visible": true,
        "locked": false,
        "color": "#4C78A8"
      }
    }
  ]
}
